<?xml version="1.0" encoding="UTF-8"?>
<cinema_booking xmlns:xsi="http://www.w3.org/2001/XMLSchema-instance"
                xsi:noNamespaceSchemaLocation="cinema_booking.xsd">
    <movies>
        <movie>
            <movie_id>1</movie_id>
            <title>Inception</title>
            <duration>148</duration>
            <genre>Sci-Fi</genre>
            <release_date>2010-07-16</release_date>
        </movie>
        <movie>
            <movie_id>2</movie_id>
            <title>The Dark Knight</title>
            <duration>152</duration>
            <genre>Action</genre>
            <release_date>2008-07-18</release_date>
        </movie>
    </movies>

    <theaters>
        <theater>
            <theater_id>1</theater_id>
            <name>IMAX Theatre</name>
            <location>City Center</location>
        </theater>
    </theaters>

    <screenings>
        <screening>
            <screening_id>1</screening_id>
            <screening_time>2024-10-08T20:00:00</screening_time>
            <movie_id>1</movie_id>
            <theater_id>1</theater_id>
        </screening>
    </screenings>

    <users>
        <user>
            <user_id>1</user_id>
            <username>john_doe</username>
            <email>johndoe@example.com</email>
        </user>
    </users>

    <reservations>
        <reservation>
            <reservation_id>1</reservation_id>
            <user_id>1</user_id>
            <screening_id>1</screening_id>
            <seat_id>1</seat_id>
            <reserved_at>2024-10-01T10:00:00</reserved_at>
        </reservation>
    </reservations>
</cinema_booking>